Date Updated,Title,Price,URL,Description
11-05,🌟 Moonlight Roller Women's Roller Skates Size 7 🌙,200,https://portland.craigslist.org/mlt/spo/d/moonlight-roller-womens-roller-skates/7683885978.html,"So they're actually a size 5, but they fit like a 7 or a 7.5 even. Maybe it's UK sizes? The Mirror Ball Moon Boot by Moonlight Roller. Color: ""Disco Ball"" with fun moon cutout on the ankle Boot: Stylish light-colored design with a sturdy wooden base. Laces up like a dream and feels super comfy! Fit: Italian-style for maximum comfort. Say goodbye to painful break-in times. These come with original wheels and 82"" laces. Specs: Genuine suede upper Painted aluminum-alloy eyelets Stabilizing tongue feature Padded lining with custom prints Cushy insole for comfy rides Light as a feather aluminum-alloy plate Adjustable PU toe stop 58mm 82A urethane wheels with an inner hub Zoom around with ABEC-7 bearings Catch you on the flip side! 🤘🛼"
11-05,InStyler Rotating Curling Iron 🔥💁‍♀️,30,https://portland.craigslist.org/mlt/hab/d/instyler-rotating-curling-iron/7683883555.html,Looking to add some waves or curls to your hair game? I've got an InStyler curling iron that's eager to find a new home. It's the secret weapon you need for those fantastic hair days! Brand: InStyler Features: - Automatic rotating action. - 3 heat settings. - Comes with an attached brush for smooth curling. Wave on! 🌊💇‍♀️
11-05,🎮 Red Nintendo DS Lite Up For Grabs!,45,https://portland.craigslist.org/mlt/ele/d/red-nintendo-ds-lite-up-for-grabs/7683883502.html,"Rad red Nintendo DS Lite! Comes with R4 ""Revolution for DS"" cartridge! Load it up with a microUSB card. It's a game-changer, literally! IYKYK Accessories: Charging cable and protective sleeve are included."
11-05,White Ankle Boots - Size Women's 7.5,25,https://portland.craigslist.org/mlt/clo/d/white-ankle-boots-size-womens-75/7683883448.html,Stylin' white with cool ribbed details. Pointy toes & chunky black heels. Slide 'em on and rock your look!
11-05,Snake boots! Size 8,30,https://portland.craigslist.org/mlt/clo/d/snake-boots-size/7683883366.html,"Edgy and unique, perfect for making a statement. Women's Size 8. Slide into these and let your wild side out! Ready to strut? These boots are waiting for you.👢✨"
11-05,Stylish GBG Ankle Boots - Women's 7.5 - Brand New!,50,https://portland.craigslist.org/mlt/clo/d/stylish-gbg-ankle-boots-womens-75-brand/7683880759.html,"Hey there! Selling these super chic black ankle boots by GBG. Brand new, never worn, size 7.5. They've got a sleek pointed toe, edgy buckle details, and a handy side zipper. Perfect for any outfit! Grab them before they're gone! 😊"
11-05,Unique Converse Platform Sneakers - Floral Design! Size 7,50,https://portland.craigslist.org/mlt/clo/d/unique-converse-platform-sneakers/7683880702.html,Hey folks! Up for grabs are these awesome Converse platform sneakers with a delicate floral pattern. They're in great condition and have a cool rugged platform sole. Perfect statement piece for any wardrobe. Don't miss out on these one-of-a-kind kicks!
11-05,Stylish Black Ankle Boots - New! - Size Women's 7.5,60,https://portland.craigslist.org/mlt/clo/d/stylish-black-ankle-boots-new-size/7683880653.html,"Hey there! Selling my sleek black ankle boots. They've got side zippers, a chic wooden heel, and cool detailing on the sole. Bonus: a fun floral-patterned inner lining. Perfect for any outfit. Brand new. Size 7.5. Grab a deal and strut in style!"
11-05,"🔥 7"" Pleasers Heels 💃 Size Women's 8",60,https://portland.craigslist.org/mlt/clo/d/pleasers-heels-size-womens/7683879981.html,"Matte faux leather custom colored metallic mauve. Women's Size 8. Edgy, unique, and ready to rock your world. 👠✨"""
11-05,Beautiful Two-Tone Woven Basket,15,https://portland.craigslist.org/mlt/hsh/d/beautiful-two-tone-woven-basket/7683878551.html,"Sturdy and stylish, this two-tone woven basket boasts a blend of natural tan and soft white hues. Measuring approximately 10 inches in height, it's perfect for storage, decoration, or as a chic accessory for outings. The basket showcases intricate weaving patterns and is accompanied by strong rope handles for easy transportation. Ideal for organizing or adding a touch of elegance to any room. In excellent condition."
11-05,Artificial Plant,20,https://portland.craigslist.org/mlt/hsh/d/artificial-plant/7683863277.html,"About 20"" tall"
11-05,Ceramic planter with tray,18,https://portland.craigslist.org/mlt/hsh/d/ceramic-planter-with-tray/7683861787.html,"9"" long by 5.5"" tall"
11-05,Elegant Round Ceramic Vase,35,https://portland.craigslist.org/mlt/hsh/d/elegant-round-ceramic-vase/7683861767.html,"Elegant round ceramic vase with a unique center cut-out design. Finished in a neutral off-white hue, making it versatile for any decor style. Perfect as a centerpiece for any room or table setting. In excellent condition."
11-05,Terracotta Plant Pot,12,https://portland.craigslist.org/mlt/hsh/d/terracotta-plant-pot/7683861738.html,"5"" tall"
11-05,Modern Abstract Vase with Marbled Accents,25,https://portland.craigslist.org/mlt/hsh/d/modern-abstract-vase-with-marbled/7683861718.html,"8"" tall contemporary cylindrical vase, showcasing a soft peach hue complemented by unique white marbled patterns. Its sleek design makes it a versatile piece for any decor. Ideal for displaying fresh or dried arrangements. In excellent condition."
11-05,"Ceramic Plant Pot 5"" tall",18,https://portland.craigslist.org/mlt/hsh/d/ceramic-plant-pot-tall/7683861699.html,"5"" tall and super cute! 💁"
11-05,Fun plant pot with stand,10,https://portland.craigslist.org/mlt/hsh/d/fun-plant-pot-with-stand/7683860183.html,6 1/4 inches tall alltogether.
11-05,Beautiful Artificial Snake Plant,30,https://portland.craigslist.org/mlt/hsh/d/beautiful-artificial-snake-plant/7683860153.html,"About 22"" tall"
11-05,Two Copper Mugs,15,https://portland.craigslist.org/mlt/hsh/d/two-copper-mugs/7683860132.html,"4"" tall, good sized mugs. Have a Moscow with a friend!"
11-05,Cutie lil artificial Monstera,10,https://portland.craigslist.org/mlt/hsh/d/cutie-lil-artificial-monstera/7683860109.html,"10"" tall. Lil cutie!"
11-05,"Various Candles, $5 each",5,https://portland.craigslist.org/mlt/hsh/d/various-candles-each/7683858080.html,Opalhouse - Holiday Spruce Goose Creek - Oud Chesapeake Bay - Confidence + Freedom Corvus Botanicals - Pumpkin Spiced Chai ??? - Eucalyptus
11-05,Ceramic Planter,15,https://portland.craigslist.org/mlt/hsh/d/ceramic-planter/7683858053.html,"Elegant white ceramic planter featuring a ribbed vertical design with a detailed scalloped rim. Stands on a sturdy base, offering a modern yet classic aesthetic. Perfect for displaying your favorite indoor plants."
11-05,Unique Ceramic Planter,12,https://portland.craigslist.org/mlt/hsh/d/unique-ceramic-planter/7683858013.html,"Beautifully textured ceramic vessel showcasing a rustic speckled finish and earthy tones. Features a distinctive handle design at the top, adding a touch of vintage charm. Ideal for decorative purposes or as a functional piece. In excellent condition."
11-05,Fun White Speckled Ceramic Planter,15,https://portland.craigslist.org/mlt/hsh/d/fun-white-speckled-ceramic-planter/7683857988.html,""
11-05,"Dish Set: dinner plates, small plates, bowls",15,https://portland.craigslist.org/mlt/hsh/d/dish-set-dinner-plates-small-plates/7683857939.html,A little scratched up. Comes with: - 4 Bowls - 3 Small plates - 7 Large plates (one has a chip)
11-05,Cutie Gilded Cat Mug,12,https://portland.craigslist.org/mlt/hsh/d/cutie-gilded-cat-mug/7683856042.html,😻
11-05,Big Butt Mug,8,https://portland.craigslist.org/mlt/hsh/d/big-butt-mug/7683856007.html,🍑🍑🍑🍑🍑🍑🍑 Holds 16 oz
11-05,Diatomaceous Earth - Barely used!,8,https://portland.craigslist.org/mlt/hsh/d/diatomaceous-earth-barely-used/7683855968.html,"I used a little of this to control sugar ants, but I don't need the rest. Comes with the duster to apply it. Can be used for gardening, pest control, etc!"
11-05,Small ceramic vase,10,https://portland.craigslist.org/mlt/hsh/d/small-ceramic-vase/7683855921.html,"It's about 8"" tall."
11-05,Small Artificial Succlent trio with pot and stand,9,https://portland.craigslist.org/mlt/hsh/d/small-artificial-succlent-trio-with-pot/7683855892.html,"10"" tall 🌵🌵🌵"
11-05,SHARON's Florida Mug,20,https://portland.craigslist.org/mlt/hsh/d/sharons-florida-mug/7683848939.html,"Illustration features: - Flamingo! - Sailboarding! - Tiger! - Waterslide! - Hybiscus! - Palmtree! - Castle? - Sealife! - Pondlife! - Spacelife! Perfect for Sharons, Shannons, and Shawns."
11-05,Actually pretty cute tiger mug 👀,10,https://portland.craigslist.org/mlt/hsh/d/actually-pretty-cute-tiger-mug/7683848913.html,I wonder what his name is. Rawr!
11-05,Doublewalled Glass travel mug/thermos,15,https://portland.craigslist.org/mlt/hsh/d/doublewalled-glass-travel-mug-thermos/7683848856.html,Never used! Really nice.
11-05,Fernet Branca Glasses,28,https://portland.craigslist.org/mlt/hsh/d/fernet-branca-glasses/7683848771.html,6 amaro glasses with Fernet logo.
