Date Updated,Title,Price,URL,Description
11-05,Filterless Ultrasonic Humidifier,30,https://portland.craigslist.org/mlt/app/d/filterless-ultrasonic-humidifier/7684356344.html,"💧 Runs up to 50 hours, 'cause who wants to refill all the time? 🌟 Fits rooms up to 500 sq ft, perfect for bedrooms to living rooms. 😌 Allergy and dry skin relief. It's like a spa day, every day. 🛑 Filter-free means no extra costs or mess. 🧼 Easy fill, easy clean design – because life’s complicated enough. 🤫 Ultrasonic whisper quiet, so you can snooze without a peep. 🌀 360-degree mist nozzle – gets every corner comfy. 🎛️ One simple knob for all the control you need."
11-05,Air Jordans High Tops size 11,50,https://portland.craigslist.org/mlt/clo/d/air-jordans-high-tops-size-11/7684261451.html,""
11-05,Two small nightstands,20,https://portland.craigslist.org/mlt/fuo/d/two-small-nightstands/7684261243.html,"Two small, lightweight nightstands. Both are 15.5"" wide x 12"" deep x 21"" tall"
11-05,JBL Charge 4 Bluetooth Speaker,80,https://portland.craigslist.org/mlt/ele/d/jbl-charge-bluetooth-speaker/7684261019.html,Rugged design for durability IPX7 waterproof rating Charcoal color JBL Connect+ for linking over 100 JBL speakers
11-05,Magazine Rack,20,https://portland.craigslist.org/mlt/fuo/d/magazine-rack/7684260695.html,"26"" x 11"" x 22"" tall"
11-05,BAGGU Fanny Pack,40,https://portland.craigslist.org/mlt/clo/d/baggu-fanny-pack/7684260487.html,"COLOR: Pink Pistachio Pixel Gingham Two main compartments Interior zip pocket Measures 6 ½” × 8"" × 2"" 45.5"" adjustable strap Recycled heavyweight nylon, recycled ripstop nylon lining Machine washable"
11-05,Red Leather Nikes size 11,40,https://portland.craigslist.org/mlt/clo/d/red-leather-nikes-size-11/7684259950.html,Size 11
11-05,Genuine Suede ankle boots size 8,20,https://portland.craigslist.org/mlt/clo/d/genuine-suede-ankle-boots-size/7684259377.html,I normally wear a 7.5 and these fit great.
11-05,Boombox,15,https://portland.craigslist.org/mlt/ele/d/boombox/7684258964.html,"Comes with a cable to plug into the wall. Plays the radio well. It also plays tapes but with a little static. 19"" x 10"""
11-05,4K Ultra-HD Camcorder Bundle,50,https://portland.craigslist.org/mlt/ele/d/4k-ultra-hd-camcorder-bundle/7684258753.html,Features: 4K Ultra-HD video recording for breathtaking footage. Touch panel interface for easy navigation. Night shot function for clear recording in low light. External and microphones for high-quality audio. Wide-angle lens to capture expansive scenes. On-camera light for enhanced lighting. Carrying case for convenience and protection. USB adapter cable for easy connectivity. Also Includes: Battery charger to keep you powered up on the go. Supports microSD and USB cards for ample storage options.
11-05,"Six 10"" white dinnerplates",15,https://portland.craigslist.org/mlt/hsh/d/six-10-white-dinnerplates/7684257889.html,""
11-05,Faux String of Pearls plant in hanging pot,10,https://portland.craigslist.org/mlt/hsh/d/faux-string-of-pearls-plant-in-hanging/7684257720.html,"The pot is 5"" with an attachment for hanging on a wall."
11-05,"Vibrant Handcrafted Area Rug - 24"" x 54""",30,https://portland.craigslist.org/mlt/hsh/d/vibrant-handcrafted-area-rug-24-54/7684257443.html,"24"" x 54"""
11-05,Jute rug runner,30,https://portland.craigslist.org/mlt/hsh/d/jute-rug-runner/7684257101.html,"30"" x 8.5'"
11-05,Large dog crate,30,https://portland.craigslist.org/mlt/hsh/d/large-dog-crate/7684256880.html,"36"" length x 23"" width x 25"" height"
11-05,Fitbit Surge Fitness Superwatch - Small,50,https://portland.craigslist.org/mlt/clo/d/fitbit-surge-fitness-superwatch-small/7684059366.html,"Fitbit Surge looking for a new wrist to call home. It's still in awesome shape. Just charged it up and took it for a test run – works like a charm. Features: - GPS Tracking: Get your pace, distance, and routes on point. - Heart Rate Monitor: Keeps track of your ticker 24/7 without a chest strap. - Smartwatch Notifications: Stay connected with text and call alerts, plus control your music without touching your phone. Comes with all original accessories including charger!"
11-05,Elevated Dog Bowls,20,https://portland.craigslist.org/mlt/hsh/d/elevated-dog-bowls/7683927938.html,Elevated doggo bowls to aid your pupper's digestion! Demonstrated by Maeby 😻😻
11-05,HP ZR30w 30-inch LCD Color Monitor,50,https://portland.craigslist.org/mlt/app/d/hp-zr30w-30-inch-lcd-color-monitor/7683927431.html,"Key Features: - Sizeable Real Estate: With a 30-inch screen, you get ample space to work on multiple windows or enjoy your favorite media. - High-Quality Display: Experience vibrant colors and high-quality pictures with this HP monitor. - Connectivity Options: Comes with DisplayPort and a 24-pin DVI-D connector, providing versatile connectivity. - Comes with 6ft DisplayPort cable - Also includes an 8ft USB-C to DisplayPort connector, offering a verified plug-and-play experience for Mac users (untested with other systems, but I don't see why it wouldn't work!). - Additional Adapter: A DVI to HDMI adapter is included (untested), giving you the option to connect to a wide range of devices. Condition: The monitor is in excellent condition and has been well-cared for. It’s fully functional with bright and clear output. The screen is free of dead pixels, and the casing shows minimal signs of use. What’s Included: - HP ZR30w 30-inch LCD Monitor - Power cable - DisplayPort cable (6ft) - USB-C to DisplayPoint cable (8ft) - DVI to HDMI adapter (untested)"
11-05,Vintage Wooden Desk,75,https://portland.craigslist.org/mlt/fuo/d/vintage-wooden-desk/7683926178.html,"Sturdy with a classic design, it features three side drawers that slide out smoothly for all your storage needs. Perfect for a cozy home office or student space. Loved but ready to find a new home."
11-05,Hario Pour-Over Coffee Kettle - Elevate Your Brewing Experience!,40,https://portland.craigslist.org/mlt/hsh/d/portland-hario-pour-over-coffee-kettle/7683907827.html,"A sleek and beautifully designed Hario pour-over coffee kettle. Crafted with precision in mind, its gooseneck spout allows for accurate and controlled pouring, ensuring a consistent brew every time. Key Features: - Classic stainless steel finish, complementing any kitchen decor. - Ergonomically designed handle for comfortable grip and pour. - Precise gooseneck spout offers optimal flow rate for pour-over brewing. - Suitable for use on gas, electric, and induction stovetops. - Capacity: Perfect for brewing multiple cups. Condition: Gently used, showing minimal signs of wear. Well-maintained and ready for your next brew."
11-05,Antique Wooden Seat/Chest - Rich in Detail and Character!,60,https://portland.craigslist.org/mlt/fuo/d/portland-antique-wooden-seat-chest-rich/7683907788.html,"For sale is a stunning antique wooden chest, brimming with history and charm. A beautiful addition to any living space, providing both aesthetics and functionality. It needs some repair: the seat part on the right side needs to be nailed back in (see photo). At the moment it should not be sat on. There is also a bit of metal detail missing from the left side (see photo). Key Features: - Dimensions: 36"" x 21"" x 27 inches tall - Beautifully crafted wooden chest with intricate metal detailing - Unique lattice design on the top surface - Sturdy metal latches and handles, adding to its vintage charm - Robust wooden legs for stability - Ample storage space inside, perfect for blankets, keepsakes, or other treasures This chest is not only a functional storage solution but also a statement piece that can elevate the decor of any room. Its rich wood tones and detailed craftsmanship make it a one-of-a-kind find."
11-05,Dimmable Pendant Light 💡,10,https://portland.craigslist.org/mlt/fuo/d/portland-dimmable-pendant-light/7683907750.html,"Brighten up your space with a touch of vintage charm. Features: - Length: 8-foot cord. - Design: Sleek, minimalistic design perfect for any modern or rustic decor. - Function: Dimmable feature to set the ambiance of your room just right. - Bulb: Retro-style Edison incandescent bulb for that added vintage touch. - Installation: Easy to install, ready to illuminate any corner of your home. Perfect for over the dining table, kitchen counter, or any space needing a dash of style."
11-05,Stunning Large Glass Vase,45,https://portland.craigslist.org/mlt/hsh/d/portland-stunning-large-glass-vase/7683907707.html,"Add a touch of elegance to your home decor with this stunning large glass vase. Its classic design can seamlessly complement any room, suitable for showcasing various decorative items, from flowers to colored sand. Details: - Crafted from high-quality, transparent glass. - Versatile and timeless design. - Ideal for centerpieces or enhancing your home's aesthetic. - Maintained in excellent condition. Elevate your living space with this vase, embodying both charm and sophistication. A valuable addition waiting to grace your home. Don't miss this fantastic opportunity!"
11-05,Decorative Pouf 🎨,30,https://portland.craigslist.org/mlt/fuo/d/portland-decorative-pouf/7683907664.html,"Elevate the aesthetics of your home with this intricately designed decorative pouf. Features: - Dimensions: 19-inch diameter, 10 inches tall. - Design: Rich patterns featuring a mix of earthy and vibrant colors that effortlessly complement a range of decor styles. - Material: High-quality fabric ensuring durability. - Utility: Perfect as a footrest, additional seating, or just as a decorative piece. - Edge Detailing: Detailed with a contrasting trim for a refined touch. Ideal for living rooms, bedrooms, or any space that could use a hint of artistic flair. Add a touch of sophistication and comfort to your home. Grab it before it's gone!"
11-05,Dell Monitor,0,https://portland.craigslist.org/mlt/zip/d/dell-monitor/7683906540.html,Totally works. Comes with plug and 15-pin connector cable (see photo)
11-05,Stylish Ceramic Pot with Stand 🌱🏺,30,https://portland.craigslist.org/mlt/fuo/d/portland-stylish-ceramic-pot-with-stand/7683905389.html,Enhance your interior with this contemporary gray ceramic pot with a wooden stand. A perfect addition to any space! Details: - Chic gray ceramic design. - Comes with a sturdy wooden stand. - Ideal for indoor plants and decor. A stylish pot that's perfect for any room or office. An ideal choice for those looking to add a touch of nature to their surroundings.
11-05,💡HappyLight - Beat the Winter Blues! 🌞,25,https://portland.craigslist.org/mlt/ele/d/portland-happylight-beat-the-winter/7683905345.html,"Wave goodbye to PDX winter gloom and say hello to sunshine vibes, even indoors! Selling my compact HappyLight, perfect for those combatting seasonal blues. Details: Brand: Verilux. Model: VT41. High-intensity light to elevate your mood. Perfectly sized for any desk or workspace. Condition: Light up your world! Works brilliantly. Very gently used. 🌞 Get ready to shine bright, even when the weather's not playing nice. Ideal for those who feel the winter slump or just want a little extra glow while working/studying."
11-05,🎵 Dive into the Vinyl Era with a 1960s Webcor Portable Record Player!,69,https://portland.craigslist.org/mlt/ele/d/portland-dive-into-the-vinyl-era-with/7683905297.html,"Description: Embrace the vintage vibes with this authentic 1960s Webcor record player. A fusion of retro charm and modern functionality, it's a timeless piece that promises a trip down memory lane. Watch it Work: Check it out in action in this YouTube video: https://youtu.be/v_00Lxv_LoY Features: Tube Amps: Immerse yourself in the warm and rich sounds exclusive to vintage tube amps—a treat for true audiophiles. Detachable Speakers: Get creative with your sound setup thanks to the removable speakers. When the party's over, they tuck away seamlessly for easy transport. Built to Last: With a suitcase-like design for portability and a hefty build indicating its prime quality, this player is a mix of style and durability. Characterful Functionality: Although the player boasts flawless functionality, its age is charmingly evident—a drive belt that needs a gentle nudge and a stylus that might prefer an upgrade. Its quirks only enhance its vintage essence, delivering an unmatched analog sound. Additional Details: Rediscover the magic of vinyl and bask in analog excellence. Perfect for collectors, sound enthusiasts, or anyone fond of vintage allure, this Webcor player is more than just an item—it's a story, an era, a sentiment. Note: Due to its vintage nature, it's sold as-is. We recommend local pick-up given its dimensions and weight. Ready to spin some classics? Don't miss this chance to own a slice of musical history."
11-05,"Della 14,000 BTU Portable Air Conditioner",225,https://portland.craigslist.org/mlt/app/d/della-btu-portable-air-conditioner/7683903284.html,"Stay cool and comfortable during those hot summer days with the powerful Della 048-GM-48265 Portable Air Conditioner! Features: - Brand: Della - Model: 048-GM-48265 - Cooling Capacity: 14,000 BTU - Remote control - Comes with a 5 1/2 foot exhaust tube - Adjustable window attachment to fit most window types - Evaporative technology for efficient cooling - Dimensions: 18” x 14” x 34” - Easy to move around with built-in caster wheels This unit is in excellent condition and functions perfectly. It's great for apartments, homes, or any space where a permanent AC installation or window unit isn't feasible. Set up is a breeze, and it's designed to efficiently cool your space without being a bulky eyesore."
11-05,Black Vintage Schwinn Bike,100,https://portland.craigslist.org/mlt/bik/d/portland-black-vintage-schwinn-bike/7683903240.html,"Stunning vintage Schwinn with black frame contrasted by new vibrant teal handlebar wraps. Has not been ridden in three years but has been kept in shed out of the elements this entire time-will need tuning up. My partner rode this bike to and from work with regular maintenance from 2016-2019, she's 5'6"" and felt the bike was always just a little too big for her so upgraded to a smaller frame. Features include: - 21'' frame - New teal handlebar wraps - Responsive Shimano gear mechanism - Small tear on seat but seat was comfortable so never replaced it - Bike lock included! - Will need tuned up due to not being ridden in awhile"
11-05,Chrome and Leather Chair,80,https://portland.craigslist.org/mlt/fuo/d/portland-chrome-and-leather-chair/7683903194.html,"An iconic retro piece-beautifully crafted chrome and grey leather chair that's been well maintained over the years. Its minimalist design, combined with leather seating, makes it a perfect blend of form and function. Bonus-the design is made so the chair bounces if you'd like while sitting on it-very comfortable (great of fidgeters)! Only selling due to upcoming cross country move."
11-05,Gorgeous Vintage Peugeot Bicycle,300,https://portland.craigslist.org/mlt/bik/d/portland-gorgeous-vintage-peugeot/7683903143.html,"Experience the thrill of the road with this beautifully maintained and restored custom Peugeot Mixte frame bicycle. Its radiant purple hue paired with its efficient design and iconic Peugeot frame is sure to make you stand out and ride with pride. Bike was bought from local hobbiest in early 2020 with years of experience restoring old bikes-new parts added old ones fine tuned-had only been ridden once since custom ordered and stored in climate controlled basement ever since. Wheel size: 27-inch wheels, which are common for road bikes and perfect for a smooth ride. Frame: Iconic Peugeot Mixte frame, known for its stylish design and durable construction. Frame height: 21 inches, suitable for riders of a specific height range, ensuring comfortable and efficient pedaling. New tires: Freshly replaced, offering a smooth and reliable ride. Handlebars: Wrapped in matching purple, ensuring grip and comfort. Elegant detailing: From the distinct purple frame to the intricate gears and chain. Condition: Excellently maintained with little to no visible wear. Whether you're commuting through the city, taking a leisurely weekend ride, or adding to your bicycle collection, this custom Peugeot Mixte bicycle offers a blend of style, history, and performance."
11-05,🔥 Weber Genesis Propane Grill 🔥,375,https://portland.craigslist.org/mlt/app/d/weber-genesis-propane-grill/7683903081.html,"Description: Model: Weber Genesis. Dimentions: 61” x 26” x 46 1/2” Grilling Area: 19” x 26” Features: Stainless steel finish with spacious grilling area, side burner, and all-weather cover. Condition: Used but still firing up great. Push-button igniter works. A few signs of wear, but nothing that affects performance. Key Features: Heat Control: Multiple knobs for perfect grilling precision. Convenience: Comes with a side burner for those simmering sauces or side dishes. Storage: Cabinet space below for storing propane tank and other grilling essentials. Additional Information: If you're looking to get your grill on, then this is the BBQ for you! I've had many a memorable meal thanks to this grill, but due to my upcoming cross-country move, I've got to pass it on to the next BBQ master. Comes with an empty (but refillable) propane tank."
11-05,5 qt Crock Pot,30,https://portland.craigslist.org/mlt/app/d/qt-crock-pot/7683895525.html,"Crock pot, works great!"
11-05,Molcajete Mortar and Pestle,10,https://portland.craigslist.org/mlt/hsh/d/molcajete-mortar-and-pestle/7683895472.html,""
11-05,Jabra Solemate Bluetooth Speaker,25,https://portland.craigslist.org/mlt/hsh/d/jabra-solemate-bluetooth-speaker/7683895422.html,Great little bluetooth speaker!
11-05,Large glass bowl,15,https://portland.craigslist.org/mlt/hsh/d/large-glass-bowl/7683895373.html,"About 10"" tall x 11"" wide with a 9"" opening. I have been using it as a punch bowl."
11-05,Large copper saucepan,45,https://portland.craigslist.org/mlt/hsh/d/large-copper-saucepan/7683893347.html,Well loved but still in great shape.
11-05,12 Qt Calphalon Stock Pot,35,https://portland.craigslist.org/mlt/hsh/d/12-qt-calphalon-stock-pot/7683893307.html,Hard anodized aluminum stock pot. Well loved but still in great shape.
11-05,Beautiful Marble Shelves with Mounting Brackets - Set of 3,35,https://portland.craigslist.org/mlt/fuo/d/beautiful-marble-shelves-with-mounting/7683893266.html,"For sale is a set of three elegant marble shelves, perfect for adding a touch of luxury to any space. Their timeless design complements both modern and traditional interiors. - Shelf 1 & 2: - Dimensions: 24"" x 8"" - Features: Smooth marble finish with a thickness of 3/4 inches. - Brackets: Comes with 5-inch gold-tone mounting brackets. - Shelf 3: - Dimensions: 30"" x 3"", with a thickness of 3/4 inches. - Special Features: Has a drilled hole and a unique notch where a mirror used to fit. These characteristics give the shelf added versatility and design options. - Brackets: 3-inch gold-tone mounting brackets, offset for a distinct look. All shelves are in great condition. The marble displays a stunning natural pattern, and the included brackets make installation a breeze. Whether you're looking to showcase decorative items, store essentials, or display art, these shelves offer both style and functionality."
11-05,LG Window Air Conditioner - Excellent Condition!,200,https://portland.craigslist.org/mlt/app/d/lg-window-air-conditioner-excellent/7683893215.html,"Looking to sell my LG window air conditioner. This powerful unit is sure to keep you cool during the hot summer months. Features: - Brand: LG - Window-mounted design for easy installation - Comes with remote control and installation hardware. - Multiple airflow and temperature settings (as seen in the digital display) - Front and side vents for efficient cooling - Clean and well-maintained unit - Sleek white finish that blends with most window frames and room decor - Dimensions: 19.5"" x 12.5"" x 19.5"" This AC has been lightly used and is in excellent condition. It's great for apartments, homes, or any space where efficient cooling is needed. Installation is straightforward, and the unit is designed to fit most standard windows. It was the NYT Wirecutter top pick for window units!"
11-05,8oz Angelus Grey Taupe Acrylic Leather Paint,8,https://portland.craigslist.org/mlt/art/d/8oz-angelus-grey-taupe-acrylic-leather/7683893178.html,Two unopened 4oz bottles for sale $4 each. Works great.
11-05,Premium Hemlock Lumber 17 pieces,100,https://portland.craigslist.org/mlt/mat/d/premium-hemlock-lumber-17-pieces/7683891112.html,"Details: Quantity & Size: 15 pieces: 6 ft x 1 5/8 in x 1/2 in (Plus two more that I partially stained for free if you want) 2 pieces: 6 ft x 2.5 in x 1/2 in Wood Type: Hemlock Condition: Brand new, unused. Bought for a project that I never got around to."
11-05,Leather Tub Chair - Vintage Charm with Modern Appeal,75,https://portland.craigslist.org/mlt/fuo/d/portland-leather-tub-chair-vintage/7683891051.html,"I started painting this chair with Angelus Acrylic Leather Paint, but I ran out and now I'm moving and I need to sell it. The leather paint works great though! Amazon link: https://a.co/d/g0BOOOS $75 or best offer Aside from the leather needing a refresh, the chair is in great shape and a comfortable, stylish place to sit. Dimensions: 32"" wide x 35"" deep x 31"" tall"
11-05,8 qt Stainless Steel Bowl,15,https://portland.craigslist.org/mlt/hsh/d/qt-stainless-steel-bowl/7683890942.html,You know it when you see a great bowl.
11-05,7qt Dutch Oven LOL,60,https://portland.craigslist.org/mlt/hsh/d/7qt-dutch-oven-lol/7683890884.html,Gorgeous Tramontina 7qt dutch oven. Fantastic condition. One small chip in the enamel on the handle.
11-05,Mosa Whipped Cream Dispenser 😉🍦,35,https://portland.craigslist.org/mlt/hsh/d/mosa-whipped-cream-dispenser/7683888660.html,"Mosa brand: The first and only 100-percent stainless steel cream whipper. Used. Tested: working great! Gasket is in good shape. Can be used with CO2 or Nitrous. - 1/2-liter, brushed stainless steel bottle; 100 % stainless steel head - Designed and created especially for professional chefs and culinary specialists; holds up to 1 pint - Keeps whipped cream fresh in the refrigerator, up to 2 weeks; 100% dishwasher safe - Includes 2 decorator tips with metal base, & charger holder"
11-05,Peloton Cycling Shoes - Size: women's 38 (7 US),60,https://portland.craigslist.org/mlt/clo/d/peloton-cycling-shoes-size-womens-38-us/7683888589.html,Authentic Peloton cycling shoes! - Pre-installed hardware/clips compatible with Peloton bikes. - Size: women's 38 (7 US) - Condition: Gently used
11-05,Elegant Genuine Leather Oxford Shoes - Size 39 (US 7.5),40,https://portland.craigslist.org/mlt/clo/d/elegant-genuine-leather-oxford-shoes/7683888527.html,For sale is a pair of sophisticated oxford shoes crafted from genuine leather! EU size 39. I'm usually a size 7.5 and they fit great.
11-05,"Brand New Pleasers 8"" Heels - Size 8",70,https://portland.craigslist.org/mlt/clo/d/brand-new-pleasers-heels-size/7683888463.html,"I've got an untouched pair of Pleasers waiting for the perfect feet to flaunt them! In a sultry deep red with a clear design twist, these babies are a stiletto lover's dream. Rock 'em and tower over your admirers. 😉✨ I'm normally a size 7.5, and these were a little big on me. Oops!"
11-05,"8"" Hella LipKit Boujee boots - Size 8",100,https://portland.craigslist.org/mlt/clo/d/hella-lipkit-boujee-boots-size/7683886207.html,"✨Never-worn 8"" Hella LipKit Boujee boots, size 8. Step up your style game! 👢 I'm normally a size 7.5 and these were a little big on me... and then I forgot to return them 😭"
11-05,Nike Air Vapormax - Size Women's 7,100,https://portland.craigslist.org/mlt/clo/d/nike-air-vapormax-size-womens/7683886150.html,"Hey sneakerheads! 🌟 Dive into the freshest kicks on the block. Introducing the Nike Air Vapormax 2020 FK Women's Shoe in the sleek and rare Flyknit Summit White. Yes, you read that right – it's a discontinued colorway, making it a collector's dream! New in the box! 💎 ✨ Brand new, never worn, in the box ✨ Fun, unique sole design ✨ Size Women's 7 Slide into style and get ready to flaunt these beauties on your next night out, workout session, or just a casual day out. But hurry, shoes this cool won't last long! Grab yours now and strut in style! 💃👟 #SneakerFreak #LimitedDrop #NikeMagic"
11-05,Nike Running Water Bottle,10,https://portland.craigslist.org/mlt/spo/d/nike-running-water-bottle/7683886102.html,Stay hydrated on the go with this sleek Nike running water bottle! 🏃‍♂️💧 Features a comfy handle and a handy pouch for your essentials. Perfect for those who love to move! Grab yours and make every run smoother! 👟🔥 #StayThirstyMyFriends
11-05,🔥 Nasty Gal Silonna boots - Size Women's 7,40,https://portland.craigslist.org/mlt/clo/d/nasty-gal-silonna-boots-size-womens/7683886035.html,"🔥 Nasty Gal Silonna boots! Black checkerboard design on a killer 5"" platform heel. Brand new in the box. Size: Women's US 7 / EU 38. These were the wrong size and I forgot to return them in time 😭 Lucky you! 💃👢"
